<?xml version="1.0" encoding="UTF-8"?>
<bibliotheque xmlns:xsi="http://www.w3.org/2001/XMLSchema-instance"
              xsi:noNamespaceSchemaLocation="example_schema.xsd">
    <livre id="L001">
        <titre>Le Petit Prince</titre>
        <auteur>Antoine de Saint-Exupéry</auteur>
        <annee>1943</annee>
        <genre>Conte philosophique</genre>
        <prix>12.50</prix>
        <disponible>true</disponible>
    </livre>
    
    <livre id="L002">
        <titre>1984</titre>
        <auteur>George Orwell</auteur>
        <annee>1949</annee>
        <genre>Dystopie</genre>
        <prix>15.99</prix>
        <disponible>false</disponible>
    </livre>
    
    <livre id="L003">
        <titre>Orgueil et Préjugés</titre>
        <auteur>Jane Austen</auteur>
        <annee>1813</annee>
        <genre>Roman classique</genre>
        <prix>9.99</prix>
        <disponible>true</disponible>
    </livre>
</bibliotheque>